{
  "schema_version": "tsf_mission_envelope_v1",
  "mission_id": "synthetic-codex-implementation-0001",
  "mission_revision": 1,
  "parent_mission_id": null,
  "project_id": "TSF_CONTROL_PLANE",
  "original_request": "SYNTHETIC FIXTURE: implement one bounded TSF documentation artifact.",
  "normalized_goal": "Create and verify one bounded TSF-local artifact in an isolated branch and worktree.",
  "mission_type": "bounded_implementation",
  "worker_role": "builder_worker",
  "recommended_surface": "CODEX",
  "model_policy_alias": "BALANCED",
  "resolved_model": "gpt-5.6-terra",
  "reasoning_effort": "MEDIUM",
  "model_selection_assurance": "ADAPTER_VERIFIED",
  "permission_mode": "WORKSPACE_WRITE",
  "network_policy": "PROHIBITED",
  "control_plane_service_network_policy": "CODEX_SERVICE_ONLY",
  "worker_tool_network_policy": "DISABLED",
  "repository_allowlist": ["TSF_CONTROL_PLANE"],
  "forbidden_repositories": ["PRODUCT_REPOS", "CANONICAL_NWR", "PRIVATELENS"],
  "source_allowlist": ["TSF_CONTROL_PLANE"],
  "forbidden_sources": ["NORMAL_NWR_PACKETS", "SECRETS", "CREDENTIALS"],
  "branch_worktree_policy": { "branch_required": true, "worktree_required": true, "expected_branch": "work/synthetic-contract-dogfood", "expected_worktree": "TSF_SYNTHETIC_WORKTREE", "starting_head": "b6862e5796250c6caa9dcee756c51b4365c45848", "unexpected_advance_behavior": "REVIEW_REQUIRED" },
  "allowed_reads": ["fleet/control", "tools", "tests"],
  "allowed_writes": ["docs/hq/synthetic-contract-dogfood"],
  "forbidden_actions": ["push", "merge", "deploy", "install", "network", "product_repo_mutation"],
  "completion_criteria": ["Create the bounded artifact and pass its required static test."],
  "required_tests": [{ "test_id": "synthetic-static-check", "required": true, "command": "synthetic only" }],
  "required_artifacts": [{ "path": "docs/hq/synthetic-contract-dogfood/result.md", "hash_required": true }],
  "required_verifier_independence": "SEPARATE_ROLE",
  "stop_conditions": ["Unexpected file touch.", "Network request.", "Branch or worktree mismatch.", "Verifier failure."],
  "approval_references": [],
  "policy": { "policy_commit": "b6862e5796250c6caa9dcee756c51b4365c45848", "manifest_version": "tsf_policy_manifest_v1", "fingerprint": "e800654710f75279327e8fa26747bcb9c67e1984e7bed9df64d3deb16a0774ef", "mission_schema_version": "tsf_mission_envelope_v1", "expected_result_schema_version": "tsf_result_envelope_v1" },
  "created_at": "2026-07-10T12:00:00Z",
  "expires_at": "2026-07-17T12:00:00Z",
  "stale_state_behavior": "REVIEW_REQUIRED",
  "required_result_envelope_version": "tsf_result_envelope_v1"
}
